{
  "schemaVersion": "1.0",
  "reference": {
    "sources": [],
    "notes": "No external visual reference; restrained editorial motion language."
  },
  "styleGuide": {
    "palette": [
      "paper #F7F1E3",
      "ink #17332E",
      "coral #E66D5A",
      "blue #5C93B8",
      "yellow #E9BE4B",
      "green #719A78"
    ],
    "typography": "One primary sans-serif family; exact large captions; no decorative labels.",
    "composition": "Persistent spatial anchors; action remains focal; avoid slide-like card grids except for explicit comparison.",
    "motion": "Causal motion with anticipation, action, reaction and settle; camera follows attention.",
    "identity": [
      "host remains characterId host",
      "ball remains one recurring prop identity"
    ]
  },
  "story": {
    "hook": "A character tries to move inside a page and hits its boundary.",
    "progression": [
      "contrast page movement with action",
      "show continuous pursuit",
      "make the causal chain explicit",
      "connect camera rhythm and sound to time"
    ],
    "payoff": "Continuous action resolves the thesis: video is time-organized story, not moving slides."
  },
  "beatSheet": [
    {
      "id": "hook",
      "start": 0,
      "end": 5,
      "purpose": "Establish the problem through failed action.",
      "viewerRead": "Movement without meaningful action is the problem."
    },
    {
      "id": "problem",
      "start": 5,
      "end": 11,
      "purpose": "Contrast position change with goal-directed action.",
      "viewerRead": "A moving page is not an acting character."
    },
    {
      "id": "motion",
      "start": 11,
      "end": 18,
      "purpose": "Show continuous pursuit as state change.",
      "viewerRead": "Animation is visible change over time."
    },
    {
      "id": "causal",
      "start": 18,
      "end": 25,
      "purpose": "Make see→approach→touch→reaction explicit.",
      "viewerRead": "Actions cause subsequent states."
    },
    {
      "id": "system",
      "start": 25,
      "end": 32,
      "purpose": "Coordinate camera, rhythm and sound.",
      "viewerRead": "Time is deliberately organized."
    },
    {
      "id": "payoff",
      "start": 32,
      "end": 40,
      "purpose": "Deliver the thesis as a visual consequence.",
      "viewerRead": "The action itself proves the point."
    }
  ],
  "shotList": [
    {
      "id": "s01",
      "start": 0,
      "end": 1.5,
      "beatId": "hook",
      "startState": "host idle",
      "endState": "host notices boundary",
      "action": "lookAt + lean",
      "actor": "host",
      "target": "boundary",
      "camera": "push"
    },
    {
      "id": "s02",
      "start": 1.5,
      "end": 3.2,
      "beatId": "hook",
      "startState": "host ready",
      "endState": "host runs toward boundary",
      "action": "run with urgency",
      "actor": "host",
      "target": "boundary",
      "camera": "follow"
    },
    {
      "id": "s03",
      "start": 3.2,
      "end": 5,
      "beatId": "hook",
      "startState": "host running",
      "endState": "host hits and reacts",
      "action": "impact + recoil + settle",
      "actor": "host",
      "target": "boundary",
      "camera": "impact push"
    },
    {
      "id": "s04",
      "start": 5,
      "end": 7,
      "beatId": "problem",
      "startState": "page static",
      "endState": "page elements swap positions",
      "action": "position change without goal",
      "actor": "page",
      "target": "layout",
      "camera": "static"
    },
    {
      "id": "s05",
      "start": 7,
      "end": 11,
      "beatId": "problem",
      "startState": "host sees ball",
      "endState": "host reaches and reacts",
      "action": "track + reach + grab + react",
      "actor": "host",
      "target": "ball",
      "camera": "pan"
    },
    {
      "id": "s06",
      "start": 11,
      "end": 13.2,
      "beatId": "motion",
      "startState": "ball ahead",
      "endState": "host commits to pursuit",
      "action": "lookAt + accelerate",
      "actor": "host",
      "target": "ball",
      "camera": "follow"
    },
    {
      "id": "s07",
      "start": 13.2,
      "end": 15.5,
      "beatId": "motion",
      "startState": "host pursuing",
      "endState": "host catches up",
      "action": "run along path",
      "actor": "host",
      "target": "ball",
      "camera": "follow"
    },
    {
      "id": "s08",
      "start": 15.5,
      "end": 18,
      "beatId": "motion",
      "startState": "host near ball",
      "endState": "host reaches and responds",
      "action": "reach + contact + reaction",
      "actor": "host",
      "target": "ball",
      "camera": "push"
    },
    {
      "id": "s09",
      "start": 18,
      "end": 19.3,
      "beatId": "causal",
      "startState": "host unaware",
      "endState": "host notices ball",
      "action": "lookAt",
      "actor": "host",
      "target": "ball",
      "camera": "hold"
    },
    {
      "id": "s10",
      "start": 19.3,
      "end": 21.5,
      "beatId": "causal",
      "startState": "host notices ball",
      "endState": "host approaches",
      "action": "walk toward target",
      "actor": "host",
      "target": "ball",
      "camera": "follow"
    },
    {
      "id": "s11",
      "start": 21.5,
      "end": 23.2,
      "beatId": "causal",
      "startState": "host approaches",
      "endState": "contact occurs",
      "action": "reach + touch",
      "actor": "host",
      "target": "ball",
      "camera": "push"
    },
    {
      "id": "s12",
      "start": 23.2,
      "end": 25,
      "beatId": "causal",
      "startState": "contact occurs",
      "endState": "host reacts",
      "action": "recoil + settle",
      "actor": "host",
      "target": "ball",
      "camera": "settle"
    },
    {
      "id": "s13",
      "start": 25,
      "end": 27,
      "beatId": "system",
      "startState": "quiet timeline",
      "endState": "beat activates",
      "action": "anticipate + activate markers",
      "actor": "host",
      "target": "beat",
      "camera": "push"
    },
    {
      "id": "s14",
      "start": 27,
      "end": 29.5,
      "beatId": "system",
      "startState": "beat active",
      "endState": "camera and character respond",
      "action": "celebrate on beat",
      "actor": "host",
      "target": "beat",
      "camera": "push"
    },
    {
      "id": "s15",
      "start": 29.5,
      "end": 32,
      "beatId": "system",
      "startState": "response active",
      "endState": "response settles",
      "action": "follow-through + settle",
      "actor": "host",
      "target": "beat",
      "camera": "settle"
    },
    {
      "id": "s16",
      "start": 32,
      "end": 34,
      "beatId": "payoff",
      "startState": "host starts run",
      "endState": "host accelerates with ball",
      "action": "run",
      "actor": "host",
      "target": "ball",
      "camera": "follow"
    },
    {
      "id": "s17",
      "start": 34,
      "end": 37,
      "beatId": "payoff",
      "startState": "host running",
      "endState": "host reaches final position",
      "action": "carry action + secondary motion",
      "actor": "host",
      "target": "ball",
      "camera": "follow"
    },
    {
      "id": "s18",
      "start": 37,
      "end": 40,
      "beatId": "payoff",
      "startState": "host reaches payoff",
      "endState": "host reacts and thesis resolves",
      "action": "celebrate + settle + thesis",
      "actor": "host",
      "target": "ball",
      "camera": "settle"
    }
  ],
  "timeline": {
    "fps": 30,
    "events": [
      {
        "id": "b0",
        "time": 0,
        "kind": "beat",
        "ref": "hook"
      },
      {
        "id": "b1",
        "time": 5,
        "kind": "beat",
        "ref": "problem"
      },
      {
        "id": "b2",
        "time": 11,
        "kind": "beat",
        "ref": "motion"
      },
      {
        "id": "b3",
        "time": 18,
        "kind": "beat",
        "ref": "causal"
      },
      {
        "id": "b4",
        "time": 25,
        "kind": "beat",
        "ref": "system"
      },
      {
        "id": "b5",
        "time": 32,
        "kind": "beat",
        "ref": "payoff"
      },
      {
        "id": "v1",
        "time": 3.2,
        "kind": "visual",
        "ref": "impact"
      },
      {
        "id": "v2",
        "time": 22.214,
        "kind": "visual",
        "ref": "contact"
      },
      {
        "id": "a1",
        "time": 3.2,
        "kind": "audio",
        "ref": "impact-accent"
      },
      {
        "id": "a2",
        "time": 22.214,
        "kind": "audio",
        "ref": "contact-accent"
      }
    ]
  },
  "review": {
    "checks": [
      "hook in first 2 seconds",
      "every shot has visible state change",
      "stable recurring identity",
      "no dead-air intervals",
      "mobile readability",
      "audio/visual sync",
      "contact sheet and motion strip",
      "record worst three defects"
    ],
    "repairLoop": [
      "render",
      "inspect",
      "diagnose",
      "repair",
      "rerender",
      "reinspect"
    ]
  }
}
